[
  {
    "id": "testlocation",
    "title": "TestLocation",
    "type": "poi",
    "area_id": "default-area",
    "added_at": "2025-12-22T21:23:50.736Z",
    "origin": "player-request",
    "tags": ["mystery"],
    "description": "TestLocation (poi) recently discovered during free exploration. Document notable hooks/risks before using in session."
  }
]
